{
 "version": "0.1",
 "scenario_id": "allston_flood_v1",
 "name": "Charles River flood, Allston-Riverside reach (drill)",
 "description": "A 3-hour Charles River flood in the reach between the Anderson and River St bridges, next to the David Rubenstein Treehouse. Real roads, facilities and household ids; flood extents, timing, fleet and needs are synthetic (assumptions.md); real facts in sources.md.",
 "synthetic": [
  "flood extents and timing (keyframes.geojson)",
  "Cottage Farm wastewater numbers except storage_max_m3",
  "substation trip time and all facility dependencies",
  "backup endurance, power and connector values",
  "fleet: vans, truck, crew, generators, fuel",
  "which households are assisted, their needs and the judge",
  "EMS Station 14 as response base; the Treehouse as shelter"
 ],
 "t_end_s": 14400,
 "tick_s": 60,
 "deadline_margin_s": 900,
 "district": {
  "name": "Allston-Riverside riverfront",
  "geometry": {
   "type": "Polygon",
   "coordinates": [
    [
     [
      -71.13,
      42.3528
     ],
     [
      -71.1065,
      42.3528
     ],
     [
      -71.1065,
      42.3722
     ],
     [
      -71.13,
      42.3722
     ],
     [
      -71.13,
      42.3528
     ]
    ]
   ]
  }
 },
 "hazard": {
  "type": "flood_keyframes",
  "source": "Synthetic 3 h storm timeline. Extents drawn on the OSM road network inside areas mapped as flood-exposed by Climate Ready Boston (Charles River neighborhoods) and Cambridge's 2017 vulnerability assessment (Riverside); FEMA NFHL via MassGIS for context. Dry until t=3600. See sources.md and assumptions.md. The same keyframes are in keyframes.geojson for geojson.io.",
  "keyframes": [
   {
    "t_s": 3600,
    "label": "t+60 min: Charles overtops the low bank between the Anderson and Western Ave bridges; riverside paths under water, roads still dry",
    "geometry": {
     "type": "Polygon",
     "coordinates": [
      [
       [
        -71.121012,
        42.369602
       ],
       [
        -71.119547,
        42.369505
       ],
       [
        -71.118125,
        42.36922
       ],
       [
        -71.117216,
        42.368675
       ],
       [
        -71.116557,
        42.367639
       ],
       [
        -71.116268,
        42.366482
       ],
       [
        -71.116268,
        42.365098
       ],
       [
        -71.117667,
        42.365098
       ],
       [
        -71.117736,
        42.366231
       ],
       [
        -71.118051,
        42.367073
       ],
       [
        -71.118856,
        42.367667
       ],
       [
        -71.119953,
        42.367895
       ],
       [
        -71.121446,
        42.367995
       ],
       [
        -71.123163,
        42.368407
       ],
       [
        -71.122126,
        42.369602
       ],
       [
        -71.121012,
        42.369602
       ]
      ]
     ]
    }
   },
   {
    "t_s": 5400,
    "label": "t+90 min: Soldiers Field Rd and Memorial Dr flooded between the Anderson and Western Ave bridges; first Riverside side streets",
    "geometry": {
     "type": "Polygon",
     "coordinates": [
      [
       [
        -71.121733,
        42.37007
       ],
       [
        -71.119436,
        42.369966
       ],
       [
        -71.117868,
        42.369652
       ],
       [
        -71.116703,
        42.368957
       ],
       [
        -71.115957,
        42.367794
       ],
       [
        -71.115641,
        42.366549
       ],
       [
        -71.115637,
        42.364874
       ],
       [
        -71.115797,
        42.364676
       ],
       [
        -71.116027,
        42.36463
       ],
       [
        -71.117924,
        42.36463
       ],
       [
        -71.118176,
        42.364705
       ],
       [
        -71.118285,
        42.364863
       ],
       [
        -71.118363,
        42.366158
       ],
       [
        -71.118625,
        42.366857
       ],
       [
        -71.119186,
        42.367258
       ],
       [
        -71.120065,
        42.367433
       ],
       [
        -71.121573,
        42.367536
       ],
       [
        -71.123511,
        42.367999
       ],
       [
        -71.121733,
        42.37007
       ]
      ]
     ]
    }
   },
   {
    "t_s": 9000,
    "label": "t+150 min: Riverside low streets (Banks St, Putnam Ave); Western Ave bridge approach closed; Putnam Ave substation yard flooded",
    "geometry": {
     "type": "Polygon",
     "coordinates": [
      [
       [
        -71.119432,
        42.37001
       ],
       [
        -71.117841,
        42.369692
       ],
       [
        -71.116754,
        42.369045
       ],
       [
        -71.114965,
        42.369037
       ],
       [
        -71.11374,
        42.367207
       ],
       [
        -71.113539,
        42.364597
       ],
       [
        -71.113946,
        42.362979
       ],
       [
        -71.115495,
        42.362621
       ],
       [
        -71.115374,
        42.362015
       ],
       [
        -71.118061,
        42.361163
       ],
       [
        -71.118423,
        42.36615
       ],
       [
        -71.11868,
        42.366833
       ],
       [
        -71.119217,
        42.367217
       ],
       [
        -71.120075,
        42.367389
       ],
       [
        -71.121585,
        42.367492
       ],
       [
        -71.123546,
        42.367962
       ],
       [
        -71.121697,
        42.370113
       ],
       [
        -71.119432,
        42.37001
       ]
      ]
     ]
    }
   },
   {
    "t_s": 10800,
    "label": "t+180 min: crest; River St bridge approach at Memorial Dr closed; Riverside south to River St, Soldiers Field Park",
    "geometry": {
     "type": "Polygon",
     "coordinates": [
      [
       [
        -71.113439,
        42.361402
       ],
       [
        -71.114997,
        42.360355
       ],
       [
        -71.116837,
        42.360564
       ],
       [
        -71.117015,
        42.361446
       ],
       [
        -71.118111,
        42.361137
       ],
       [
        -71.118258,
        42.36303
       ],
       [
        -71.119061,
        42.363195
       ],
       [
        -71.118662,
        42.3648
       ],
       [
        -71.119261,
        42.366996
       ],
       [
        -71.119087,
        42.367062
       ],
       [
        -71.119248,
        42.367177
       ],
       [
        -71.120086,
        42.367345
       ],
       [
        -71.121598,
        42.367448
       ],
       [
        -71.123582,
        42.367926
       ],
       [
        -71.121661,
        42.370157
       ],
       [
        -71.119422,
        42.370055
       ],
       [
        -71.117819,
        42.369734
       ],
       [
        -71.117559,
        42.369582
       ],
       [
        -71.1175,
        42.369645
       ],
       [
        -71.113949,
        42.369625
       ],
       [
        -71.112142,
        42.367613
       ],
       [
        -71.111739,
        42.365
       ],
       [
        -71.112347,
        42.362978
       ],
       [
        -71.113675,
        42.362659
       ],
       [
        -71.113439,
        42.361402
       ]
      ]
     ]
    }
   }
  ]
 },
 "facilities": [
  {
   "id": "cottage-farm",
   "type": "pumping_station",
   "name": "Cottage Farm CSO Facility (MWRA)",
   "asset_id": 0,
   "power_kw_required": 350,
   "connector": "camlock-400a",
   "connect_s": 1200,
   "backup_endurance_s": 1800,
   "depends_on": [
    "putnam-ave-sub",
    "outfall-mwr201"
   ],
   "wastewater": {
    "storage_m3": 1500,
    "storage_max_m3": 4900,
    "pump_m3ph": 10500,
    "downstream_ok": true,
    "inflow_m3ph": [
     [
      0,
      3000
     ],
     [
      3600,
      6000
     ],
     [
      5400,
      9000
     ],
     [
      9000,
      10000
     ],
     [
      10800,
      9500
     ]
    ]
   },
   "consequence": "Without power its storage fills and the overflow goes to the Charles untreated (overflow_m3)."
  },
  {
   "id": "putnam-ave-sub",
   "type": "substation",
   "name": "Putnam Avenue Substation",
   "asset_id": 7,
   "events": [
    {
     "t_s": 7200,
     "state": "down",
     "note": "pre-emptive de-energization 30 min before water reaches the yard (synthetic timing)"
    }
   ],
   "consequence": "Feeds Cottage Farm and Mount Auburn Hospital in this drill (synthetic dependency)."
  },
  {
   "id": "mt-auburn",
   "type": "hospital",
   "name": "Mount Auburn Hospital",
   "asset_id": 8,
   "critical": true,
   "power_kw_required": 450,
   "connector": "camlock-400a",
   "connect_s": 900,
   "backup_endurance_s": 32400,
   "depends_on": [
    "putnam-ave-sub"
   ],
   "consequence": "Critical-branch power lost when backup runs out."
  },
  {
   "id": "outfall-mwr201",
   "type": "outfall",
   "name": "MWRA outfall MWR201 (Cottage Farm) to the Lower Charles",
   "node": 4978289961,
   "synthetic": true,
   "consequence": "Where Cottage Farm's overflow reaches the river."
  },
  {
   "id": "ems14",
   "type": "response_base",
   "name": "Boston EMS Station 14 (drill staging)",
   "asset_id": 5,
   "capacity_people": 40,
   "consequence": "Vans, crew and fuel stage here; overflow drop-off if the shelter is cut off."
  },
  {
   "id": "treehouse-shelter",
   "type": "shelter",
   "name": "David Rubenstein Treehouse (drill shelter)",
   "node": 382400901,
   "synthetic": true,
   "capacity_people": 200,
   "consequence": "Drop-off point for every rescue; truck and generators stage in its lot."
  }
 ],
 "resources": [
  {
   "id": "van-1",
   "kind": "van",
   "name": "Van 1",
   "at_facility": "ems14",
   "capacity_people": 6,
   "fuel_l": 60,
   "fuel_l_per_km": 0.15,
   "service_s": 300
  },
  {
   "id": "van-2",
   "kind": "van",
   "name": "Van 2",
   "at_facility": "ems14",
   "capacity_people": 6,
   "fuel_l": 60,
   "fuel_l_per_km": 0.15,
   "service_s": 300
  },
  {
   "id": "van-3",
   "kind": "accessible_van",
   "name": "Accessible Van 3",
   "at_facility": "ems14",
   "capacity_people": 6,
   "accessible": true,